Fakf,Loading the activated carbon filter
Fetraflamode,Submodes of the FeTraFla mode
Fetrawe,"Implementation of manufacturing, transport and workshop mode with tester"
Fho,Correction factor height
Frk_st_comf,Array index corresponding to firing order example SYZYLZA4 - fstaw03
Gangi_at,Gear displayed in the station wagon
Gangi_roh,Raw value gear
I_batt_zse,Battery current of ZSE battery measured by ZSE-IBS
I_dcdc,Current DCDC converter
I_eff_gs,Drive train reinforcement
I_ibsl,Battery power from IBS
I_pcuist_n1,Current measured by PCU
I_pcuist_n2,Current measured by PCU
Ibsl_status,Status input for IBSCTRL
IdxSegNavgrph2,Reference to the segment ID of the ADAS Horizon v14 extended information
Ieltst_testernelsoll,E-fan setpoint from the tester job
Ieltst_testerrelais,E-fan relay control value from the tester job
Ierr_grenz_ext,Limit excitation current from the tester
Isglkt_chipherst,Chip manufacturer VDA-LIN generator
Isglkt_chipvers,Chip version VDA-LIN generator
Isglkt_dfreg,Utilization of VDA-LIN generator
Isglkt_herst,Manufacturer code VDA-LIN generator
Isglkt_ierrgrenzok,Copy limit excitation current VDA-LIN generator
Isglkt_ierrreg,Excitation current VDA-LIN generator
Isglkt_makenn,Machine type VDA-LIN generator
Isglkt_rrzok,Copy of load response time VDA-LIN generator
Isglkt_tchipreg,Chip temperature VDA-LIN generator
Isglkt_uist,Actual voltage VDA-LIN generator
Isglkt_uok,Copy of target voltage VDA-LIN generator
Isgtst_testerierrg,Setpoint specification of limit excitation current from tester
Isgtst_testerrrz,Setpoint load response time from tester
Isgtst_testersgr,Setpoint specification SGR operating mode from tester
Isgtst_testerusoll,Target voltage specification from tester
Km_restrwrex,"Transfer of the current range extender range based on the current tank content. In this range value, the range due to the battery charge level is not taken into account"
Km_st_1,Distance km accurate to 1km
Kvaverbr,Fuel consumption (injection quantity in microliters)
Kw_pos,Absolute engine position
Kw_pos_em1,Position EM1
Kw_pos_sst,Distance of the target cylinder (at the moment of observation) from its ZOT (from an engine perspective)
Kw_umdr_em1,Revolution counter EM1
LSegNavgrph2,This signal contains the length of the current segment
L_pwmout,Duty cycle e-fan
La_diag_xab,Lambda for plausibility check specific to exhaust gas pandemic
La_puls_xab,Excitation of linear lambda controllers (forced la stimulation) specific to the exhaust gas bank
La_soll_tester_xab,Lambda requirement tester exhaust gas bank specific
La_vk_xab,Lambda measurement value before catalytic converter
LimVNavgrph2,This signal contains the speed limit of the current segment
M_ges_fzg,Weight mass vehicle
Md_em1_ist,Actual torque of the electric motor
Md_em1_max_siko_dme,Max limit for EM1 from RB level 2 or BMW level 2
Md_em1_max_xctl_egs,Maximum controller limit for drag start
Md_em1_min_siko_dme,Min limit for EM1 from RB level 2 or BMW level 2
Md_em1_min_xctl_egs,Minimum controller limit for drag start
Md_em1_res_vm_start,Reserve starting torque
Md_em1_soll_ebs,Charge and assist request EM1
Md_em_nctl_stat,Stationary slow torque component of the EM12 speed controller (EM12 project-specific)
Md_gb1_l,Slow torque intervention from the gearbox
Md_gb1_s,Fast torque intervention from the gearbox
Md_getriebe,Gearbox input torque
Md_lmv_v_ist,Actual moment of the longitudinal moment distribution to the front (relative to the shaft)
Md_lmv_v_soll,Target torque of the longitudinal torque distribution to the front (relative to the shaft)
Md_loss_grb,Torque loss of the gearbox based on the gearbox input interface in Nm
Md_na_ac,Air conditioning compressor torque loss
Md_na_ars,Torque loss active roll stabilization
Md_na_ef,Torque loss EF (steering and ARS)
Md_na_efmax,Maximum torque loss EF (steering and ARS)
Md_na_efprae,Predicted torque loss EF (steering and ARS)
Md_na_mlad,Torque loss of mechanical loaders
Md_na_sl,Torque loss servo pump
Md_rad_brems_antr_soll,Target wheel braking torque of the drive
Md_rad_ges_max_fd,TargetMaximumWheel torqueDriving dynamicsDrivetrain
Md_rad_ges_min_fd,TargetMinimumWheel torqueDriving dynamicsDrivetrain
Md_rad_ist_kriechen_gb1,Wheel torque delivered by GB1 during crawling
Md_rad_soll,Target wheel torque from LDM
Md_rad_stab,DSC interface (fast path) requested driving sum wheel torque
Mdg_gsl_minus,Slow torque intervention EGS based on transmission input torque reduction
Mdg_gsl_plus,Slow torque intervention EGS based on transmission input torque increase
Mdg_gss_minus,Fast torque intervention EGS based on transmission input
Mdg_gss_plus,EGS quick torque intervention based on transmission input
Mdg_max_gs,Maximum permissible transmission input torque through EGS emergency running
Mdi_nmax,Moment of maximum speed reduction
Mdi_res_ac,Torque reserve for the air conditioning compressor
Mdi_res_diag,Reserve torque from OBD probe dynamic diagnosis
Mdi_res_sl,for power steering
Mdi_res_tev,Torque reserve for the TEV
Mdi_vmax,Vmax limit
Mdk_k0_max,Maximum transmittable torque of the separating clutch
Mox_skvk,Oxygen storage capacity of the pre-cat
Msa_dienste,Status Services Embassy MSA (ID219)
Msa_lm,Steering torque
Msa_pumpl,Pump start status DSC
Msa_qufdyn,Driving dynamics qualifier
Msa_qulm,Qualifier steering torque
Msa_qureqilk,Qualifier requirement: complete freedom from adhesion
Msa_reqfb,Requirement to establish driving readiness
Msa_stabs,ABS status
Msa_stbped,Brake pedal status
Msa_stfzg,Vehicle standstill status
Msa_stfzgpbr,Status vehicle standstill parking brake
Msa_stgrbevreq,EGS switch-on prevention recommendation
Msa_sthyb,Status from the EME
Msa_sthyb2,MSA start adhesion request MSA requirements from the AE
Msa_stkl,Status terminals
Msa_stldm,Status LDM
Msa_stled,Status operation MSA button
Msa_strtzgeschk,queried total number of starts
Mshfm,Mass flow from HFM
Mslui,Integr air mass
Msp_dneng,Speed gradient over current segment
Mste_xte,Mass flow through tank ventilation valve
N_ab_m,measured output speed (absolute value)
N_ab_real,Measured output speed (signed contains information about direction of rotation) Nabm interface is still maintained as an absolute value
N_em1_ist,Actual speed of the electric motor
N_em1_max,Maximum speed EM1
N_em1_min,Minimum speed of the electric motor due to EGS requirement
N_em1_soll_ebs,Target speed EM1 of the eBSG
N_gb1_in_max_as,Maximum input speed of gearbox 1 (drive strategy)
N_k0_in_max_as,Maximum input speed of the clutch K0 (drive strategy)
N_llr_grb_min,Idle speed increase by M-DKG
N_llr_soll_dn_ta,Delta target speed from the tester
N_llr_soll_dn_ta_ac,Delta target speed from tester with AC
N_llr_soll_dn_ta_bn,Delta target speed from the tester on-board network
N_llr_soll_dn_ta_fs,Delta target speed from the tester with FS
N_llr_soll_dn_ta_fsac,Delta target speed from the tester with AC and FS
N_rad_hl,Wheel speed on the left
N_rad_hr,Rear right wheel speed
N_rad_vl,Front left wheel speed
N_rad_vr,Front right wheel speed
N_schalt_dkg,Engine speed required by the DKG
N_soll_getr_ein,Gearbox input target speed
N_target,Expected engine speed in the target gear after shifting
N_vm_soll_egs,Target speed of the combustion engine from EGS
Navgraph2ProEvt,Nav-Graph2Profile switchingEvent
Navgraph2ProShi,Nav-Graph2 profile switching
Neig_l,Longitudinal road gradient (protected) in degrees
Neig_l_qual,Qualifier longitudinal road gradient
Neig_q,Road slope (protected) in degrees
Neig_q_qual,Qualifier road cross slope
Nelueft_klima_anf,Percentage requirement for e-fan speed from the IHKA IHKR
Nelueft_lenk,E-fan request from the steering aid
Newp_klima,Electric water pump request by the air conditioner in 0 100
Nkw_1ms,Speed size (calculation over the last tooth period synchronously every 1ms)
Nkw_1msXP,Extrapolated speed size (calculation over the last tooth period synchronously every 1ms)
Nkw_Inc_10ms,Speed in the 10ms ratser from the last crankshaft tooth period
Nkw_Tooth_10ms,Speed in the 10ms ratser from the last 6 crankshaft tooth periods
Nkw_can,CAN speed for locking STDRVVEH
Nkw_grad,Speed gradient
Nkw_grad_glmi,Speed gradient as a moving average over 2 revolutions (720)
Nkw_startende_koor,Valid starting end speed used in the functions by the supplier
Nkw_zahn,Speed from KW teeth
Nmax_var,red speed range
Nsolfa,Idle target speed function requirement tester
Nturb,Speed transmission input
On_antriebsart_cod,Coding parameters drive type (0no coding 1rear 2all-wheel drive 3front)
On_niv,Oil level for ON II with a wide range of values
Oz_lf1c,Country factor 1 coded
Oz_lf2c,Country factor 2 coded
Oz_temp,Engine oil temperature from KT
Oz_tempsmpf,Sump temperature
Ozvartyp,Oil sensor variant
P_oel_ist,Is oil pressure
P_oelsol_tst,Setpoint oil pressure via tester
Pbremsu,Brake booster vacuum hPa
Pel_pred_eps,Predicted performance EPS
Perc_wmm_ist,Actual position WMM from BOSCH function to WMK (0-100)
Pmrestore,Restore memory
Pmsv,Registered power management stand consumers
Pr_bs_soll,Should priority relief request
Pr_laden_soc,Load prioritization
Prail_bde_test,Setpoint for rail pressure from BDE test control function
Prail_ist,Rail pressure
Prail_soll_cvo,Rail pressure requirement through CVO adaptation
Prail_soll_tester,Target value for rail pressure from the tester
Profil1LNavgraph2,Length of segment 1 of the profile package
Profil1Navgraph2,Segment 1 of the profile package
Profil2LNavgraph2,Length of segment 2 of the profile package
Profil2Navgraph2,Segment 2 of the profile package
Profil3LNavgraph2,Length of segment 3 of the profile package
Profil3Navgraph2,Segment 3 of the profile package
Ps_abs,Absolute pressure suction pipe
Ps_abs_roh,Absolute pressure suction pipe
Pumg_roh,Ambient pressure raw value
Pvdkds_roh,Pressure in front of throttle valve from sensor raw value
Qelad_ibsl,Battery discharge counter
Qlad_ibsl,Battery charge counter
Qs_anf_klima,Heat requirement for DME to control eWAPU
QuanNavgrph2EvtProfil,NumberNavGraph2EventProfile
QuanNavgrph2RadProfil,NumberNav-Graph2RadiusProfile
QuanNavgrph2SloProfil,NumberNav-Graph2SlopeProfile
QuanNavgrph2TypStreetProfil,NumberNav-Graph2TypeStreetProfile
QuanNavgrph2VEstiProfil,NumberNav-Graph2SpeedProtectedProfile
QuanNavgrph2VLimProfil,NumberNav-Graph2SpeedLimitProfile
Rf_dirsta,RB-standardized filling of the first fired cylinder (100 corresponds to the amount of air in the displacement at 1013hPa and 0C)2) Not the entire array is read because rlpw is BMW's responsibility anyway
Rkte_xte,Fuel correction by TEV
RtAuinfCntNavgrph2,RouteAdditional informationLandNav-Graph2
RtOffsNavgrph2,This signal describes the current position in the route profile
RtProNavgrph2,RouteProbabilityNav Graph2
Rwdtbls,Raw data brake light signal (RDWTBLS)
Seg5z,Segment time for 5 teeth
Segakt_Ign,Current segment from the ignition task
Segakt_Inj,Current segment from the fill task
Segeln_dienste,Contains the sailing preventers from the sailing prevention service message
Soc_hvb_ist,Actual SOC
Soc_hvb_ist_delta,High-resolution SOC value (intermediate value to previous SOC)
Soc_hvb_max,Max SOC
Soc_hvb_min,Min SOC
Soc_quali_zse,Quality of charge status of ZSE battery
Soc_zse,Charge status of ZSE battery
St_ablauf_egs,EGS sequence control
St_aepllctrlin,Status word Staepllctrlin
St_aepllctrlin.B_llanhsec,LL increase request from the safety control unit
St_aepmod_in,Status input bits for HybGen functions in AEP
St_aepmod_in.B_hybsysnio_zse,EME (GEN2) AE (I12GEN3) sends converter defective and AEP must display the CCM213
St_aepzse_in,Status input bits for AEPZSE
St_aepzse_in.B_ibsnok_zse,EME does not send ZSE IBS OK
St_aepzse_in.B_ibssukrdy_zse,EME sends ZSE IBS start-up communication ready
St_akt_betriebsart_em_steuern,Petitioner
St_akt_betriebsart_em_steuern.B_akt_betriebsart_em1_steuern,Activation of EM1 control mode
St_akt_betriebsart_em_steuern.B_akt_betriebsart_em2_steuern,Activation of EM2 control mode
St_anf_em1_ebs,EM1 operating mode requirement
St_anman1,Status Anman
St_anman1.B_ldm_ena,Enable moment request from LDM
St_anman1.B_nosa,Condition SA prohibited by LDM
St_asiko,Bittrger A-Siko for level 1
St_asiko.B_asiko_nakt,TRUE Acceleration comparison deactivated FALSE Acceleration comparison activated
St_atldiag2_in,Status byte interface input
St_atldiag2_in.B_atlsvc_if,Tester requirement for diagnostic function of the exhaust gas turbocharger
St_bcu,Status BCU
St_bls.B_bls,Brake light switch condition
St_btvns,Status word tester intervention in BlsResidual gas
St_btvns.B_btvsa,Condition tester control AVANOS
St_btvns.B_btvse,Condition tester control EVANOS
St_ckl15,Status byte terminal signals from CAN
St_ckl15.B_ckl30,Condition terminal R (via CAN)
St_ckl15.B_ckl50,Condition terminal 50 (from CAN)
St_ckl15_compl,
St_ckl15_compl.B_ckl30_compl,Condition terminal R (via CAN)
St_ckl15_compl.B_ckl50_compl,Condition terminal 50 (from CAN)
St_codier_la,1 status word from coding table for LA-dependent function control
St_cvo,Status word
St_cvo.B_cvo_akt,Injection specification changed by CVO
St_cvo.B_cvo_anf,CVO adaptation requirement
St_cvo.B_cvo_anf_high,Urgent CVO adaptation requirement
St_diag,
St_diag.B_btvvta,Condition component control VVT control
St_diag_ewp_20,Status feedback of the electric coolant pump for ATL cooling (0 OK 3 NOK)
St_diag_ewp_22,Status feedback of the EWP22 (0 OK 3 NOT OK)
St_diag_ewp_23,Status of the electric coolant pump for cooling electrical components
St_diag_te_zse,Status diagnosis of separating element ZSE
St_diag_werksmodus_phev,Status of the diagnostic job for factory mode for PHEV vehicles
St_dk_diag,Status TPS diagnosis
St_dk_diag.B_dkerr_2pot,Condition: both DK pots are defective
St_dk_diag.B_ska,"SKA actively triggered via level 1, 2 or 3"
St_dk_notl,Dk emergency running status
St_dor_frei,Status register for enabling DOR diagnosis by external conditions
St_dor_frei.B_var_dor,Variant DOR detected
St_dps_svc,Status of the tester request for target intake manifold differential pressure specification (0 nothing 1 gd requirement 2 Dpssollsvcreq 3 workshop test with KDPSSVC31 and 2 4 undercionstruction 4 nv)
St_drlin,Status byte layer input DAROL
St_drlin.B_drl_rstanf,Reset request for DAROL
St_dsc_can_pre,Unprocessed status of the DSC control unit
St_dsc_ist,Is status DSC
St_dsc_mradsoll,Status of target wheel torque DSC
St_dtev,Status TEV diagnosis
St_dtev.B_dteaavz,Condition for control check for TEV diagnosis active (time delayed)
St_dtev.B_dtest,Start for TEV control
St_dtev.B_dtesvz,Active diagnosis of tank ventilation system (time delayed)
St_dtev.B_dtev_aktiv,Condition disables DPS controller through TEV diagnostics
St_dyndzm,Status word
St_dyndzm.B_dzm_dyn,Speed dynamization requirement
St_ebn_fahrbereit,Release status of the readiness to drive from the HVPM
St_eco2_buffer,Eco2 acknowledgment diagnostic buffer from RB
St_eco2_buffer.B_eco2_tbufrdy,Ecos2 condition diagnostic buffer can be filled
St_ecostat1,Ecos status byte 1
St_ecostat1.B_eco2_job,Ecos2 is set by the supplier for 1s in the diagnosis job
St_ecostat1.B_eco2_stop,Control command flag from tester jobefiistop
St_ecostat1.B_ecojob1,Ecos Job1 active again delete again after 1 second
St_ecostat1.B_ecojob2,Bed I- measurement start
St_egs,Automatic transmission status byte
St_egs.B_csn_egs,EGS in ColdStartNeutral mode (delayed first gear engagement)
St_egs.B_egs_khl1,Condition request cooling level 1 from transmission control
St_egs.B_egs_khl2,Condition requirement for cooling level 2 from transmission control
St_egs.B_nic_egs,EGS in NIC mode
St_egs_prog,Automatic transmission program status
St_einh_md_sport,Unit of the torque display in the performance display
St_einh_p_sport,Unit of performance in the performance display
St_eisydiag_pakmx_lay,Status word EisyDiagPakmx Layer
St_eisydiag_pakmx_lay.B_pakmx_clear,Condition Reset Diagnosis Exhaust pressure too high
St_eluefehler,Bitter
St_eluefehler.B_farelais,Relay error
St_eluefehler.B_farelaiskm,E-fan relay control line short circuit to ground
St_eluefehler.B_farelaiskp,E-fan relay control line short circuit to Ubatt
St_eluefehler.B_farelaisub,E-fan relay control line interrupted
St_eluefehler.B_ielpwm_fabus,PWM line error
St_eluefehler.B_ielpwm_fabuskm,E-fan PWM cable short circuit to ground
St_eluefehler.B_ielpwm_fabuskp,E-fan PWM line short circuit to Ubatt
St_eluefehler.B_ielpwm_fabusub,E-fan PWM line interrupted
St_eluefehler.B_ielpwm_masse,PWM signal pulled to ground
St_espr,Status word
St_espr.B_espr_syn,Condition injection can take place (including synchronization)
St_est_ist,Is the status of the electric steering
St_evab_misfire,Cylinders of the own SG switched off due to misfires
St_falls,Summarized statuses for speed increase of diagnosesCat diagnosisPre-cat probe diagnosis (dynamics)Pre-cat probe diagnosis (offset)Post-cat probe (swap)Post-cat probe (vibration test stuck check)Post-cat probe (transition time)Post-cat probe (response t
St_fas_mradsoll,LDM request qualifier
St_fds_config,Driving dynamics switch configuration
St_fes,Driving experience switch status
St_fg_overboost,Bitter
St_fg_overboost.B_fg_overboost_em2,Bit for enabling the overboost via the electric machine 2
St_fg_overboost.B_fg_rennstart_gb1,Bit for enabling the race start from gearbox 1
St_fg_socr_diag_obd,Status of the release of the OBD diagnosis by the SOC control
St_fg_startsystem_em1,Status of the release of the electric machine 1 as a start system
St_fzg_1,Vehicle variant
St_fzg_2,Vehicle variant
St_fzg_zstd,Driving status from DSC
St_gang,Direction and gear information (almost PRND)
St_gangplaus,Status byte gear information
St_gangplaus.B_gang_rueck_upl,Gear information invalid (on-board network signal)
St_generator,Status byte generator
St_generator.B_crashgen,Condition: Switch off generator in the event of a crash
St_getriebe,Gearbox status word
St_getriebe.B_autget,Condition automatic transmission installed
St_getriebe.B_dkgget,Condition automatic transmission installed
St_gl_zsk_ein,Status word for bits
St_gl_zsk_ein.B_gl_zsk_testerena,Bit cylinder equality tester job was requested
St_hal_diag_adapt,Status byte rear axle learning function can be activated via diagnostics
St_hal_diag_adapt.B_hal_reset_adaptionen,Activate rear axle learning function
St_ibsl_chg,4 bytes of charging statusStatusIBSLIN
St_ibsl_diag0,IBS status error byte
St_ibsl_diag1,IBS status error byte
St_ibsl_diag2,IBS status error byte
St_ibsl_diag3,IBS status error byte
St_ibsl_stat0,IBS status byte
St_ibsl_stat1,IBS status byte
St_ibsl_stat2,IBS status byte
St_icm_acfzgl,Qualifier vehicle longitudinal acceleration
St_ieltester,Bitter
St_ieltester.B_ieltst_testernelsoll,Tester job for e-fan control active
St_ieltester.B_ieltst_testerrelais,Tester job for electric fan relay control active
St_igrin,Status word Stigrin
St_igrin.B_fe,Implementation Enable production mode
St_igrin.B_fetrawedeak,"Implementation of deactivate production, transport and workshop mode"
St_igrin.B_tra,Implementation Enable transport mode
St_igrin.B_we,Implementation Activate workshop mode
St_igrinnv,Status word Stigrinnv
St_igrinnv.B_cdigronw,Write or read IGR coding data into the DDEDME
St_igrinnv.B_cdxenonw,Write xenon assembly coding data
St_igrinnv.B_diagigr,ActivationDeactivation iGR (Bit true - diagnostic job set - Igr deactivated)
St_ipmnapraein,Bitter
St_ipmnapraein.B_koakt,Air conditioning compressor condition
St_isglin,Status byte VDA-LIN generator
St_isglin.B_isglkt_fabus,VDA-LIN generator bus communication error
St_isglin.B_isglkt_fael,Electrical error VDA-LIN generator
St_isglin.B_isglkt_faht,High temperature VDA-LIN generator error
St_isglin.B_isglkt_fakom,Error communication VDA-LIN generator
St_isglin.B_isglkt_fame,Mechanical error in VDA-LIN generator
St_isglin.B_isglkt_fato,VDA-LIN generator timeout error
St_isgtst,Tester request status register
St_isgtst.B_isgtst_datenreset,Condition for resetting the generator statistics
St_isgtst.B_isgtst_testerierrg,Condition setpoint limit excitation current from tester active
St_isgtst.B_isgtst_testerrrz,Condition setpoint load response time from tester active
St_isgtst.B_isgtst_testersgr,Condition SGR operating mode specification from tester active
St_isgtst.B_isgtst_testerusoll,Condition of target voltage specification from tester active
St_khm_in,Status word
St_khm_in.B_kh_disbl_tester,Cat heaters locked by the tester
St_khm_in.B_kh_getafu,Status word
St_kl15.B_dc_new,New driving cycle with clamp change
St_kl15.B_kl15_ep,Bit size condition KL15 set
St_kl15.B_kl15_vorab,Condition KL15 pressed
St_klopfen,Status word knock
St_klopfen.B_klopfen,Knock detected
St_kr,Knock control condition
St_kr.B_krdws,Condition Knock control safety delay adjustment
St_kr.B_krndy,Speed dynamics condition for knock control active
St_kr.B_warml_zykl,Warm-up cycle completed
St_kr1,Knock control status byte
St_kr1.B_krakt,Knock control condition active
St_kupp_dkg,Condition of the starting clutch
St_kwsync,Status byte combustion engine synchronization
St_kwsync.B_kwsync,Combustor fully synchronized
St_kwsync.B_kwsync_pre,"For example, the combustion engine synchronizes due to a safe engine shutdown position"
St_laden,Current status loading
St_lam_ad,Lambda adaptation status
St_lam_ad.B_lrad_fvlra,Suspected lambda adaptation error
St_lam_ad.B_lrad_tank,Refueling process
St_lam_ad.B_lrad_tankg,Bit refueling process valid
St_lin_akt,Status word
St_lin_akt.B_lin_akt,LIN condition active
St_ll_in,Status word bits
St_ll_in.B_icm_disable,Condition ICM generally disabled
St_ll_in.B_var_afs,Condition: AFS module present in the vehicle
St_m_ges_fzg,Qualifier weight mass vehicle
St_minhubad0,Status word MINHUBAD
St_minhubad0.B_dtes,TE diagnosis condition active
St_minhubad0.B_fa,Condition Function requirement (general)
St_minhubad0.B_mdarv,Critical dropout rate exists
St_mod_egs,Operating mode switching torque speed control of the DME by EGS
St_montage,Status bearer
St_montage.B_montagemod_akt,Assembly mode currently active
St_motzustd,Motor status status word
St_motzustd.B_motlaeuft,Condition Motor is running
St_msae,Status word msae
St_msae.B_fagurt,Driver's belt buckle closed
St_msae.B_ftauf1,Driver door 1 open condition
St_msae.B_hkauf,Bit tailgate open
St_msae.B_mhauf1,Condition bonnet 1 open
St_msae.B_msa_av_zl,MSA shutdown prevention
St_msae.B_msa_deakt_zl,MSA deactivation
St_msae.B_msa_ea_zl,MSA deactivation after previous switch-on request
St_msae.B_msafzg,Vehicle with MSA HW
St_msae.B_msahistrst,Reset MSA history memory (tables and ring buffers)
St_msae.B_msaobdav,Condition onboard diagnostics active
St_msae.B_msasw,Deactivate MSA condition until the next ignition change
St_msae.B_msavadapt,MSR adaptation condition active
St_msae.B_nglern,Delete neutral position learned condition
St_msae.B_schlok,Key (ID transmitter) recognized
St_msae.B_zmsoff,Injection blocked by DMF protection function
St_msae2,Status word msae 2
St_msae2.B_ewsok,Activation status EWS
St_msae2.B_msastrtzrst,Request to save start counter readings
St_msavmkssoll_ziel,Feedback from the transmission that the power connection request has been accepted
St_msavmstsoll_ist,Feedback from the transmission about the target combustion engine status
St_msavmstsoll_ziel,Feedback from the transmission that the VM status request has been implemented
St_nachladen_hvpm,Status of the reload request
St_ndrin,Status byte layer input NDR
St_ndrin.B_ndrhddiagon,Condition Diagnosis Fuel supply system active
St_nm_ein,Bitter
St_nm_ein.B_nm_aktiv,Condition network management (on-board network communication) active
St_no_ccm,The signal contains the number of the check control message currently shown on the display
St_notl_hybrid,Emergency running request from the hybrid control unit
St_notl_hybrid_2,Request from the emergency running manager AE to the emergency running manager DME
St_notl_hybrid_3,Emergency running request from EME to the DME 3Part
St_nradcan,Status word
St_nradcan.B_err_n_rad_hl,Error identifier wheel speed HL
St_nradcan.B_err_n_rad_hr,Error identifier wheel speed HR
St_nradcan.B_err_n_rad_vl,Error identifier wheel speed VL
St_nradcan.B_err_n_rad_vr,Fault identifier wheel speed VR
St_oelsensor,Byte carrier
St_oelsensor.B_oenslerr,Bozlerr (OENS Level out of Range)
St_on,Status carrier ON
St_on.B_on_dtlmssgsrv,Werkstadttester requests a detailed level measurement
St_onabkin,Bit carrier control engine oil level measurement
St_onabkin.B_Mhaube_off,Hood open
St_onabkin.B_Moth_sok,valid bonnet signal
St_onabkin.B_onabk_ozdeaktiv,Bypass oil sensor error via diagnostics
St_onabkin.B_onabk_qntmssg_anf,Start oil measurement from MMI
St_opmo_grb,Status of gearbox operating mode
St_ozstatus,Bit-carry status engine oil level sensor
St_ozstatus.B_ozerr,Condition Engine oil level sensor error
St_ozstatus.B_oztemp,Condition engine oil temperature from cylinder head valid
St_ozstatus.B_ozterr,Condition Engine oil sensor error in the temperature detection system
St_ozstatus1,Bit carrier status engine oil level sensor
St_ozstatus1.B_oensstktok,Bstktoensok (component driver NS does not report any RM from the sensor)
St_panne,Bitter breakdown data storage
St_panne.B_crashsig,Crash signal from airbag control unit
St_panne.B_trigeve,Bit for triggering the storage of static header files
St_pmi,Status byte LCP inputs
St_pmi.B_fabttreg,Register battery replacement condition
St_pmi.B_fahisrst,Histogram reset condition
St_pmi.B_pmrestore,Condition Data written back
St_pmi_nv,Status byte LCP inputs n/a
St_pmi_nv.B_fapmmess,Condition measurement method PM
St_pmi_nv.B_ulcp,ULCP Active
St_poelreg1,Status oil pressure control 1
