Bed_bs_xab,Component protection condition active
Frfmxbsld,Factor filling limitation due to component protection at the grease limit
La_bs_xab,Component protection lambda
St_zwbts1,Status byte component protection function
St_zwbts1.B_bs1,Condition component protection bank 1 active
St_zwbts1.B_bs2,Condition component protection bank 2 active
St_zwbts1.B_lklpsbs_vk,Air flap open by pre-cat
KL_MDRED_NKW,Factor for reducing the engine target torque depending on the engine speed
CW_USECASE_WMK_TMSGET,Code word for hiding parts of the Status_usecase_wmk for the gearbox intervention function
CW_USECASE_WMK_WRNH,Code word for hiding parts of the Status_usecase_wmk for the upshift notification function
KF_MDRED_T,Factor for reducing the target motor torque depending on the temperatures
KL_MDAC_TANS,Maximum released torque for the air conditioning compressor from the WMK depending on the intake air temperature
KL_MDAC_TMOT,Maximum released torque for the air conditioning compressor from the WMK depending on the engine temperature
KL_MDAC_TOEL,Maximum released torque for the air conditioning compressor from the WMK depending on the engine oil temperature
KL_MDRED_MN,Minimum actual clutch torque released by the WMK depending on the engine speed
KL_NKWMAX_TMOT,Characteristic curve for reducing the internal combustion engine speed from heat management via the coolant temperature.
KL_NKWMAX_TOEL,Characteristic curve for reducing the combustion engine speed from heat management via the oil temperature.
KL_USECASE_WMK_TMSGET,Selection of the heat management use cases in which the gearbox intervention should be enabled.
KL_USECASE_WMK_WRNH,Selection of the heat management use cases in which the upshift notification should be activated.
K_ETA_KUEHL_AP,Factor for reducing the motor target torque to reduce heat input in the application operating class
K_MDREDMD_AP,Minimum actual clutch torque released by the WMK in the Application operating class
K_MDREDTMSGET_FS_TMOT,Minimum coolant temperature to enable torque reduction or gearbox intervention
K_MDREDTMSGET_FS_TOEL,Minimum engine oil temperature to enable torque reduction or gearbox intervention
K_MD_AC_VMA_AP,Maximum released torque for the air conditioning compressor from the WMK in the VMA in the Application operating class
K_MD_AC_VMA_RG,Maximum released torque for the air conditioning compressor from the WMK in the VMA in the regulation and control operating class
K_NKWMAX_AP,Maximum combustion engine speed in application mode.
K_NKWMAX_MN,Lowest permissible reduction in combustion engine speed from thermal management.
K_NKWMAX_MOT,Maximum possible combustion engine speed that the engine can have.
K_TD_WRNG_AUS,Length of time that the output of the yellow warning lamps is suppressed
K_TD_WRNR_AUS,Length of time that the output of the red warning lamps is suppressed
K_TMSGET_V,Minimum vehicle speed to activate the thermal engine protection in the transmission in the escalation operating class
K_TMSGET_V_HYS,Hysteresis offset for the minimum vehicle speed to activate the thermal engine protection in the transmission in the escalation operating class
K_WRNG_TMOT,Minimum engine temperature to activate the yellow warning lamp
K_WRNG_TOEL,Minimum engine oil temperature to activate the yellow warning lamp
K_WRNH_TOEL,Minimum engine oil temperature to activate the upshift warning
K_WRNR_TMOT,Minimum engine temperature to activate the red warning lamp
K_WRNR_TOEL,Minimum engine oil temperature to activate the red warning lamp
K_WRN_TMOT_EL,Reduction of the limit motor temperature to activate the warning lamps (yellow and red) in the event of an e-fan error
S_TMSGET_AP,Activation of thermal motor protection in the gearbox in the Application operating class
S_WRNG_AP,Activation of the yellow warning lamp in the Application operating class
S_WRNH_AP,Activation of the upshift warning lamp in the Application operating class
S_WRNR_AP,Activation of the red warning lamp in the Application operating class
Ba_vma_ist,Operating mode of the WMK for the VMA
Ba_vma_kla,Operating class of the WMK for the VMA
Ba_vma_zus,Operating status of the WMK for the VMA
Mdi_zw_soll_wm,internal target torque in the WMK
Nkw_wm,Combustion engine speed in WMK
St_wmeingfz_in1,Internal status word
St_wmeingfz_in1.B_el_fehler_wm,"E-fan error in the WMK [0=no error, 1=error exists]"
St_wmeingfz_in1.B_ewp_fehler_wm,"EWP error in WMK [0=no error, 1=error exists]"
St_wmeingfz_in1.B_fahrbereit_wm,"Status of readiness to drive in the WMK [0=not ready to drive, 1=ready to drive]"
St_wmeingfz_in1.B_kl15_start_wm,Bit for detection activation terminal 15
St_wmeingfz_in1.B_kl15_wm,"Status terminal 15 in WMK [0=inactive, 1=active]"
St_wmeingfz_in1.B_puls_sek_wm,Second pulse in WMK is true once per second
St_wmeingfz_in1.B_wadu_wm,Request to close the KKS when water crossing is detected.
St_wmeingfz_in1.B_wischerakt_wm,"Status of the windshield wipers in the WMK [0=inactive, 1=active]"
St_wmeinvma_in2,internal status word
St_wmeinvma_in2.B_kwdreht_start_wm,Crankshaft begins to rotate (rising edge B_kwdreht)
St_wmeinvma_in2.B_kwdreht_wm,"Rotation of the crankshaft in WMK [0=no rotation, 1=rotation]"
St_wmeinvma_in2.B_msastop_wm,"Motor in MSA stop phase in WMK [0=no MSA stop, 1=MSA stop]"
St_wmeinvma_in2.B_prail_wm,Request to the WMK to lower the temperatures due to the rail pressure
St_wmeinvma_in2.B_tegs_akt_vma,T_egs temperature present and current (automatic transmission installed / bus reports T_egs present)
St_wmeinvma_in2.B_tegs_fehler_vma,Error detection/invalidity detection in the signal from T_egs
St_wmeinvma_in2.B_vskr_f,"Fuel filtering calculation [0=no calculation, 1=calculation]"
St_wmeinvma_in2.B_zel_fehler_vmgen,"Additional E-fan error in the WMK of VMGEN [0=no error, 1=error exists]"
St_wmeinvma_in5,internal status word
St_wmeinvma_in5.B_dkg_wm,"DKG gearbox detected in WMK [0=no DKG, 1=DKG detected]"
St_wmeinvma_in5.B_handget_wm,"Manual gearbox detected in WMK [0=no HS, 1=HS detected]"
Status_usecase_wmk,Detected thermal management use case
Tans_wm,Plausibility-checked intake air temperature in the WMK
Tmot_wm,Internal combustion engine coolant temperature in the WMK
Toel_wm,Engine oil temperature in the WMK
V_wm,Vehicle speed in WMK
Ba_vma_mdac_ist,Operating mode of the WMK for climate reduction in the VMA
Ba_vma_mdac_kla,Operating class of the WMK for climate reduction in the VMA
Ba_vma_mdac_zus,Operating status of the WMK for climate reduction in the VMA
Ba_vma_mdred_ist,Operating mode of the WMK for torque reduction in the VMA
Ba_vma_mdred_kla,Operating class of the WMK for torque reduction in the VMA
Ba_vma_mdred_zus,Operating state of the WMK for torque reduction in the VMA
Ba_vma_tmsget_ist,Operating mode of the WMK for gearbox intervention in the VMA
Ba_vma_tmsget_kla,Operating class of the WMK for gearbox intervention in the VMA
Ba_vma_tmsget_zus,Operating state of the WMK for gearbox intervention in the VMA
Ba_vma_wrng_ist,Operating mode of the WMK for the yellow warning lamp in the VMA
Ba_vma_wrng_kla,Operating class of the WMK for the yellow warning lamp in the VMA
Ba_vma_wrng_zus,Operating status of the WMK for the yellow warning lamp in the VMA
Ba_vma_wrnh_ist,Operating mode of the WMK for the upshift message in the VMA
Ba_vma_wrnh_kla,Operating class of the WMK for the upshift message in the VMA
Ba_vma_wrnh_zus,Operating state of the WMK for the upshift message in the VMA
Ba_vma_wrnr_ist,Operating mode of the WMK for the red warning lamp in the VMA
Ba_vma_wrnr_kla,Operating class of the WMK for the red warning lamp in the VMA
Ba_vma_wrnr_zus,Operating status of the WMK for the red warning lamp in the VMA
Eta_kuehl_es,Factor for reducing the motor target torque to reduce the heat input in the escalation operating class (is limited to 1 in ASCET)
Eta_kuehl_mx,Factor for reducing the motor target torque to reduce heat input (limited to 1 in ASCET)
Fmdred_nkw,Factor for reducing the engine target torque depending on the engine speed
Fmdred_t,Factor for reducing the target motor torque depending on the temperatures
Md_ac_tans,Maximum released torque for the air conditioning compressor from the WMK depending on the intake air temperature
Md_ac_tmot,Maximum released torque for the air conditioning compressor from the WMK depending on the engine temperature
Md_ac_toel,Maximum released torque for the air conditioning compressor from the WMK depending on the engine oil temperature
Md_ac_vma_es,Maximum released torque for the air conditioning compressor from the WMK in the VMA in the escalation operating class
Mdk_kuehl_es,Maximum actual clutch torque released by the WMK
Mdk_kuehl_es_p,Maximum actual clutch torque released by the WMK as a product of Mdi and Eta without taking the minimum torque into account
Nkw_max_anf,Maximum combustion engine speed from heat management
Nkw_max_temp,Maximum combustion engine speed calculated from the temperatures from the thermal management
St_wmschutzvma_in2,internal status word
St_wmschutzvma_in2.B_mdredtmsget_fs,Activation of torque reduction and gearbox intervention.
St_wmschutzvma_in2.B_usecase_wmk_tmsget,The gearbox intervention is requested using the thermal management use case.
St_wmschutzvma_in2.B_usecase_wmk_wrnh,The upshift message is requested based on the thermal management use case.
St_wmschutzvma_in2.B_wrnh_ba_wm,Activation of the upshift message for the driver based on the operating mode
St_wmschutzvma_in2.B_wrnh_es,Activation of the upshift warning in the escalation operating class
St_wmschutzvma_in2.B_wrnr_es,Activation of the red warning lamp in the escalation operating class
St_wmschutzvma_in2.B_wrnr_es_tmot,Activation of the red warning lamp in the escalation operating class due to the engine temperature
St_wmschutzvma_in2.B_wrnr_es_toel,Activation of the red warning lamp in the escalation operating class by the engine oil temperature
Status_usecase_wmk_tmsget,Detected heat management use case for the gearbox intervention function
Status_usecase_wmk_wrnh,Detected thermal management use case for the upshift warning function
Md_ac_vma,Maximum released torque for the air conditioning compressor from the WMK in the VMA
Mdk_kuehl_mx_wm,Maximum actual clutch torque released by the WMK
Nkw_max_wm,Maximum combustion engine speed specified by heat management
St_wmschutzvma_in1,internal status word
St_wmschutzvma_in1.B_tmsget_es,Activation of the thermal motor protection in the transmission in the escalation operating class
St_wmschutzvma_in1.B_tmsget_wm,Activation of thermal engine protection in the transmission by adapting the switching strategy
St_wmschutzvma_in1.B_wrng_es,Activation of the yellow warning lamp in the escalation operating class
St_wmschutzvma_in1.B_wrng_es_tmot,Activation of the yellow warning lamp in the escalation operating class due to the engine temperature
St_wmschutzvma_in1.B_wrng_es_toel,Activation of the yellow warning lamp in the escalation operating class due to the engine oil temperature
St_wmschutzvma_in1.B_wrng_wm,Activation of the yellow warning lamp
St_wmschutzvma_in1.B_wrnh_wm,Activation of the upshift warning for the driver
St_wmschutzvma_in1.B_wrnr_wm,Activation of the red warning lamp
St_wmschutzvma_in3,internal status word
St_wmschutzvma_in3.B_mdr_akt_wm,Torque reduction active
St_wmschutzvma_in3.B_mdredtmsget_fs_tmot,Activation of torque reduction and gearbox intervention via the coolant temperature.
St_wmschutzvma_in3.B_mdredtmsget_fs_toel,Activation of torque reduction and gearbox intervention via the engine oil temperature.
St_wmschutzvma_in3.B_nkwmax_r,Resetting the flip-flop for the information memory entry speed reduction WM
St_wmschutzvma_in3.B_tmsget_v,Activation of the thermal engine protection in the transmission depending on the vehicle speed
St_wmschutzvma_in3.B_wrng_anf_wm,Request to activate the yellow warning lamp
St_wmschutzvma_in3.B_wrnh_aktiv_wm,"Upshift advice enabled [1=upshift warning enabled, 0=upshift warning disabled]"
St_wmschutzvma_in4,internal status word
St_wmschutzvma_in4.B_nkwmax_s,Setting the flip-flop for the information memory entry speed reduction WM
St_wmschutzvma_in4.B_nkwmax_wm,Setting the information memory entry speed reduction WM
K_Anteil_PWG,Weighting of the PWG share for calculation BMWosc_fac_DfcoDrvgSit_ub
K_F_SOT_RUECKBLICK_RS,Offset for factor for burbles when downshifting
K_F_SOT_RUECKBLICK_STAND,Factor for burbles when stationary
K_MDKIST_SOT_MX,Normalization for Mdk_ist_sot_mem_mx
K_PWGIST_SOT_MX,Normalization for Pwg_ist_sot_mem_mx
K_SOT_N_MEM,Number of past values of Mdk_ist and Pwg_ist
K_V_SOT_MN,Minimum driving speed for burbles
S_SOT_CALC,Calculation of the factor for burbles
Mdk_ist,Current crankshaft torque on axle with combustion engine
Pwg_ist,Pedal value driver's request
St_egsprog_kor,corrected EGS program
B_sot_rs,Backshift detected
Cnt_sot_mem,Counter for stored values of Pwg_ist and Mdk_ist
Mdk_ist_sot_mem,Stored values of Mdk_ist
Mdk_ist_sot_mem_mx,Largest stored value of Mdk_ist
Pwg_ist_sot_mem,Stored values of Pwg_ist
Pwg_ist_sot_mem_mx,Largest stored value of Pwg_ist
BMWosc_fac_DfcoDrvgSit_ub,Factor for burbles
Md_emk_ist_Haxl,Current torque from electric motor on crankshaft from rear axle
Mdk_ist_vm,Actual VM torque on the crankshaft averaged over the number of cylinders
Mdk_ist_m,Current crankshaft torque on axle with combustion engine
Mdk_ist_Haxl,Current crankshaft torque from the combustion engine on the rear axle
Absch_korr,[SS_EXP] Correction value shutdown
Aepmsadiag_fr,[SS_EXP] Rescue some values from MSAINFO that need to be flash resistant
Anz_stvar_comfstart,"Number of ""Comfort"" MSA starts"" carried out"
Anz_stvar_keystart,Number of key starts performed
Anz_stvar_normalstart,"Number of ""Normal"" MSA starts"" performed"
Anz_stvar_respstart,"Number of response ""MSA starts"" carried out"
Anz_stvar_sicherstart,"Number of ""Safe"" MSA starts"" performed"
Anz_zyl_aus_nl_mot,Total number of cylinders switched off due to errors and active additional shutdown due to rough running related to the engine
Array_bzs_vm_deak,Effective disablers for VM
Array_bzs_vm_ea,Effective power-on prompts for VM
Array_bzs_vm_ev,Effective power-on preventers for VM
Array_vm_fav,Effective driver shutdown preventers for VM
Array_vm_sav,Effective system shutdown preventers for VM
Aspr,Outlet spread setpoint
Aspr_noncsers,Exhaust spread setpoint (nonCSERS for CSERS diagnosis MY2013)
Atlsvc_dpvdk1,Differential pressure before DC of both turbochargers
Atlsvc_dpvdk2,Differential pressure before DK with turbocharger 1
Atlsvc_dpvdk3,Differential pressure before DK with turbocharger 2
BMWMonChain_ag_CmOfsOv_sw,Output offset NW adaptation
BMWMonChain_ag_CmStr_uw,Starting values of the NW flanks
BMWMonChain_ag_StcStd_uw,Standard deviation of the NW adaptations in the last evaluation interval
BMWMonChain_ag_StrValFild_sw,Starting value for calculating the output value
BMWMonChain_ag_TrigImme_sw,Update history last display value before correction
BMWMonChain_ag_UpdHist_sw,Update history correction value
BMWMonChain_milg_TrgOld_uw,Update history includes the previous calculation
BMWMonChain_milg_TrigImme_uw,Update history kmst when corrected
BMWMonChain_qlf_CmOfs_ub,Qualifier for offset NW adaptation
BMW_acvn_PclFilHtr,This signal requests an adapted hybrid operating strategy for heating the gasoline particulate filter
BMW_acvn_PclFilRecu,This signal requests an adapted hybrid operating strategy to regenerate the gasoline particle filter
BMW_st_AdpHvsSocMin,Signal requires an increase in SOCmin depending on HVS temperature
BMWaep_b_FbExtRqrt_bo,replaces St_aepubnkor.B_can_ovrakt
BMWas_st_Em1OpmSp_ub,Target operating mode of the electric machine 1 (0: Standby 1:Torque control 3: Electric machine voltage control 5:Speed control with torque precontrol 6:HV battery current control 8:Active short circuit 10:Free running)
BMWas_st_StruModEdr_ub,Status configuration start-up mode hybrid
BMWausy_p_PclFilAft_uw,"Pressure after particulate filter (gasoline particulate filter, OPF), seen in mass flow direction"
BMWcbsoz_b_AcvnCfmAvlMoOil_bo,Activation_Confirmation-Availability_Motoreol_Ist
BMWchc_b_GcWup_bo,request warm-up gear shift (lower gears - higher engine speed)
BMWchc_b_HtClsFlp_bo,Exhaust flap closure request due to Kat-Heating
BMWchc_st_OpmDt_ub,Catalyst heating coordinator operating mode for drivetrain (ST_CAT_HT)
BMWchc_ti_DlyGearEngdDid_ub,Remaining time preventing gear engagement due to emissions
BMWchdiag_b_1DiagEndTot_bo,t.b.d
BMWchdiag_fac_ObdNormTot_sw,t.b.d
BMWchdiag_st_OpmTst_ub,Feedback tester in the event of an error Demo CSERS diagnosis combustion engine load point reduction.
BMWchhyb_b_St_bo,Release status for the ability to select E-mode
BMWchm_stb_1_ub,"Codeword for Catalyst heating - maintain temperature, (0: BMWchm_b_Ena_bc, 1: BMWchm_b_lam_Splt_bc, 2: BMWchm_TqRsv_bc, 3: BMWchm_PucInh_bc, 4: BMWchm_InjPuc_bc, 5: BMWchm_b_GcWup_bc, 6: BMWchm_b_OpmTc_bc)"
BMWchm_stb_1_ub.BMWchm_b_GcWup_bc,"Catalyst heating maintain temperature() bit, boolean, flag, binary message or variable(log. condition) gear change(gear change) warmup(warm up) Bit in carrier byte (bit)"
BMWchm_stb_1_ub.BMWchm_b_InjPuc_bc,"Catalyst heating maintain temperature() bit, boolean, flag, binary message or variable(log. condition) injection pull fuel cut off Bit in carrierbyte (bit)"
BMWchm_stb_1_ub.BMWchm_b_OpmTc_bc,"Catalyst heating maintain temperature() bit, boolean, flag, binary message or variable(log. condition) operating mode turbo charger Bit in carrierbyte (bit)"
BMWchm_stb_1_ub.BMWchm_b_PucInh_bc,"Catalyst heating maintain temperature() bit, boolean, flag, binary message or variable(log. condition) pull fuel cut off inhibit bit in carrier byte (bit)"
BMWchm_stb_1_ub.BMWchm_b_TqRsvDyn_bc,"Catalyst heating maintain temperature() bit, boolean, flag, binary message or variable(log. condition) torque(torque) reserve(reserve, reserve, reserve, stock) dynamic(dynamic) Bit in carrierbyte (bit)"
BMWchm_stb_1_ub.BMWchm_b_TqRsv_bc,"Catalyst heating maintain temperature() bit, boolean, flag, binary message or variable(log. condition) torque(torque) reserve(reserve) Bit in carrierbyte (bit)"
BMWchm_stb_1_ub.BMWchm_b_VvtDi_bc,throttled operation mode requested.
BMWchm_stb_1_ub.BMWchm_b_lam_Splt_bc,"Catalyst heating maintain temperature() bit, boolean, flag, binary message or variable(log. condition) a/fratio (lambda)(a/fratio (lambda)) split bit in carrier byte (bit)"
BMWchm_tq_Rsv_sw,Catalyst heating maintain temperature() torque(torque) reserve(reserve) signed Word (sint16)
BMWcluspd_n_LstMaxAttdn_uw,Last known maximum clutch speed in danger zone
BMWcluspd_nr_ClasMaxAttdnAry_ub,Classification of maximum attained value from CluSpd
BMWclutemp_t_Clu_sw,temperature clutch
BMWcpena_b_Ena_bo,general Enable condition for canister purge
BMWcpsup_stb_PTank_ub,carrier for bits
BMWcpsup_stb_PTank_ub.BMWcpsup_b_CcPgEfcEna_bc,Enable efficient canister purge measures (general enable from the driving condition point of view).
BMWcpsup_stb_PTank_ub.BMWcpsup_b_CcPgEfcPsbl_bc,efficient canister purge possible (for pressure tank)
BMWcpsup_stb_PTank_ub.BMWcpsup_b_CcPgEfc_bc,Efficient carbon canister purge active.
BMWcpsup_stb_PTank_ub.BMWcpsup_b_CcSocRstPTank_bc,Reset CcSoc due to requested pressure release occurred.
BMWctb_ag_ExcrCtlOutAry_sw,Angle of excenter correction to apply to cylinders with index from BMWctb_idx_ExcrClcdAry - output value
BMWctb_ag_ExcrCtlStatAry_sw,Statistical eccentric angle correction values
BMWctb_ag_IgOutXcy_sw,Ignition angle offset per cylinder - output value
BMWctb_amp_Eo05_uw,Amplitude of engine order 0.5
BMWctb_amp_Eo10_uw,Amplitude of engine order 1.0
BMWctb_amp_Eo15_uw,Amplitude of engine order 1.5
BMWctb_amp_Eo20_uw,Amplitude of engine order 2.0
BMWctb_amp_Eo25_uw,Amplitude of engine order 2.5
BMWctb_amp_Eo30_uw,Amplitude of engine order 3.0
BMWctb_ct_ChkEfc_uw,Current counter value for check whether Ctb is effective
BMWctb_ct_ExcrCtlAcvStatXcy_uw,Counter stroke correction active for respective cylinder
BMWctb_ct_ExcrPermDgraT_ub,Counter excenter angle correction degraded due to VVT temperature or overload
BMWctb_idx_ExcrCtlOutAry_ub,Index of cylinders to apply excenter angle correction - output value
BMWctb_idx_ExcrCtlStatAry_ub,Cylinders most frequently selected for stroke correction according to statistics
BMWctb_lur_DifXcs_sw,"Filtered Lur values of cylinders (comparing cylinders among each other), all cylinders"
BMWctb_lur_RndXcs_sw,"Filtered absolute delta Lur values of each cylinder (current cycle vs. previous cycle, due to random combustion variation), all cylinders"
BMWctb_pct_CrtnAdpXcy_sw,Adapted correction percentage
BMWctb_pct_CrtnOutXcy_sw,Correction percentage output value
BMWctb_pct_ExcrCtlAcvStatAry_ub,Relative frequency stroke correction according to statistics active on one and two cylinders
BMWctb_pct_InjOutXcy_sw,Injection correction per cylinder - output value
BMWctb_st_TstrOut_uw,Status word Combustion Torque Balancing for Tester output
BMWdor_b_TherMgrSpAcv_bo,Control of the WMM by DorDiag is currently active
BMWdrl_nr_SwVer_ub,Internal Software Version of DrlGbk to be read out by SGBD-Job
BMWeisy_b_InltCsNotPlau_bo,Status inlet cross section implausible threshold
BMWeisy_mf_LeakNormDiag_sw,"standardized leakage mass flow between the compressor outlet and inlet valve (normalized: based on reference temperature and critical pressure ratio, i.e. this mass flow is a measure of the leakage cross section)."
BMWeng_b_Str_bo,Start condition
BMWext_b_DewPclFilXab_bo,The end of the dew point on the particle filter has been reached
BMWext_t_GasEngFilXab_sw,"Exhaust gas temperature at the manifold inlet from AMOT, filtered via DynFlt"
BMWext_t_GasInPclFilXab_sw,Exhaust gas temperature in the middle of the particle filter
BMWfanstc_cnt_StcAftRunRly,Statistic Array 2 of Fanstc: Accumulated Numbers of E-Fan Afterruns and Relay Switching Cycles
BMWfanstc_pct_StcThd,E-fan statistics thresholds
BMWfanstc_ti_StcCtlDur,Statistic Array 1 of Fanstc: Accumulated Time of Control Duration.
BMWfcovvt_b_Deac_bo,Deactivation of variable valve train (max. valve lift)
BMWfcovvt_b_VvtLiho_bo,VVT system in limphome mode (throttle engine operation requested).
BMWgpf_b_CrtnSootReq,Correction of soot model: request
BMWgpf_b_GcRgnHt_bo,  The same as warmup gearshift (higher rpm) request for heating particular filter
BMWgpf_b_HtAcvInfoForMsfDet,Triggers an expansion of the thresholds for misfire detection during OPF heating
BMWgpf_b_IntpRgnReq,OPF: Request interruption of an active regeneration
BMWgpf_b_PfTstrSootPcgCmpl,Status tester job for preconditioning OPF sufficiently filled
BMWgpf_m_AshXab,Total ash in the particle filter (Mdl+Adp) (exhaust bank-specific)
BMWgpf_m_CrtnSootRelValXab,Correction of soot model: relative value
BMWgpf_m_LoadXab,Total load (soot + ash) in the particle filter (exhaust bank-specific)
BMWgpf_m_SootRgnUrNrm,Normalization value to determine the urgency after loading
BMWgpf_rat_RgnUr_sw,Regeneration urgency from BMW software
BMWgpf_st_PclFilRgnTstrEva,"Gasoline particulate filter(Otto particle filter) status, state(status, condition, bit string) Particle(particle) filter(filter) regeneration(regeneration) Workshop Tester(tester, workshop tester) evaluate(evaluate, assess)"
BMWgpfdiag_dst_AshLifeEnd,Estimated distance until OPF will be fully loaded with ash
BMWgpfdiag_m_gra_Asch,Ash gradient (g/1000km)
BMWgpfdiag_st_GpfBltnRdy,Process information for installation diagnosis of particle filter (OPF)
BMWgpfheat_b_HtClsFlp_bo,Exhaust flap closure request due to OpfHeating
BMWhip_ag_MonHppSp_Ary,Ring buffer rail monitoring - HDP control
BMWhip_dst_MonTrig_Ary,Ring storage rail monitoring - mileage
BMWhip_gra_MonPSp_Ary,Ring buffer rail monitoring - rail pressure dynamics
BMWhip_n_MonN_Ary,Ring buffer rail monitoring - speed
BMWhip_p_MonEfpSp_Ary,Ring storage rail monitoring - EKP pre-feed pressure
BMWhip_p_MonPAct_Ary,Ring buffer rail monitoring - actual pressure
BMWhip_p_MonPSp_Ary,Ring buffer rail monitoring - target pressure
BMWhip_rat_MonEfpPwm_Ary,Ring buffer rail monitoring - EKP control
BMWhip_t_MonFu_Ary,Ring buffer rail monitoring - fuel temperature
BMWhip_volf_MonFu_Ary,Ring storage rail monitoring - volume flow
BMWign_b_BasDyn_bo,Dynamic detection for basic ignition angle
BMWign_b_BasKnkLimd_bo,Basic ignition angle is limited to knock
BMWign_b_ag_KnkCtlOut_bo,Ignition angle from Knock Control is being output
BMWign_ct_PlugSootEstdRst,Counter-protected free-burning processes of spark plug soot
BMWign_fac_PlugSootEstd_uw,Factor protected ZK soot
BMWign_t_PlugEstd,Rudimentary estimated spark plug temperature
BMWilauim_i_AltAct_sw,Generator current (according to USM)
BMWilauim_n_Alt_sw,Speed machine
BMWilauim_pct_AltLoad_uw,Electrical utilization machine
BMWilauim_tq_AltMdl_sw,Generator torque
BMWinjafs_fac_AirStoi_uw,Actual value air stoichiometric
BMWisc_b_tq_InttBol_bo,Condition I portion of the BMW LLR is stopped due to lower system limits
BMWisgusm_i_AltPwrClas_ub,
BMWlam_rat_FacMixAdp2BndXak_sw,Ratio of the current mixture adaptation factor F_lradap_xak to the min or max limit (1.0 means: limit value has been reached)
BMWlhm_b_HiPLihoRpsErr_bo,Emergency running with high pressure due to high pressure sensor error (common rail pressure sensor)
BMWlhm_st_EdrRngDispOff,Status word request to hide the electric range display in the station wagon (temporary / permanent).
BMWlhm_st_HybRea_ub,Status hybrid reactions bit-coded
BMWlhm_st_HybRea_ub.BMWlhm_b_FuRngDispOff_bc,Request for station wagon: deactivate fuel reserve display
BMWlhm_st_HybRea_ub.B_egshy_def_mdlim,Disable crawling
